{
  "$schema": "../mcuSchema.json",
  "partInfo": {
    "partNumber": "nRF54L05-QGAA",
    "packageType": "QFN-52",
    "sizeDescription": "6x6x0.85mm, 0.4mm pitch QFN-52",
    "datasheetVersion": "https://docs-be.nordicsemi.com/bundle/ps_nrf54L15/page/pdf/nRF54L05_nRF54L10_nRF54L05_Preliminary_Datasheet_v0.9.pdf"
  },
  "renderConfig": {
    "canvasDefaults": {
      "padding": 20
    },
    "chipBody": {
      "width": 6,
      "height": 6,
      "centerX": 0,
      "centerY": 0,
      "cornerRadius": 0.3,
      "fillColor": "#4A4A4A",
      "strokeColor": "#222222",
      "strokeWidth": 0.5,
      "orientationMarker": {
        "size": 0.3,
        "fillColor": "#FFFFFF",
        "offsetX": -3.6,
        "offsetY": 2.7
      }
    },
    "layoutStrategy": {
      "layoutType": "quadPerimeter",
      "pinCounts": {
        "bottom": 13,
        "left": 13,
        "right": 13,
        "top": 13
      },
      "numberingStart": {
        "corner": "topLeft",
        "direction": "counterClockwise",
        "side": "left"
      },
      "pinOffsetFromEdge": 0,
      "pinPitch": 0.4
    },
    "pinDefaults": {
      "shape": "rect",
      "width": 0.1,
      "height": 0.2,
      "fillColor": "#B0B0B0",
      "strokeColor": "#707070",
      "strokeWidth": 0.2
    }
  },
  "pins": [
    {
      "packagePinId": "1",
      "name": "P1.00",
      "port": "P1",
      "pinIndex": 0,
      "defaultType": "crystal_lf",
      "isClockCapable": false,
      "powerDomain": "peripheral",
      "functions": ["XL1", "Digital I/O", "Analog input"],
      "side": "left"
    },
    {
      "packagePinId": "2",
      "name": "P1.01",
      "port": "P1",
      "pinIndex": 1,
      "defaultType": "crystal_lf",
      "isClockCapable": false,
      "powerDomain": "peripheral",
      "functions": ["XL2", "Digital I/O", "Analog input"],
      "side": "left"
    },
    {
      "packagePinId": "3",
      "name": "P1.02",
      "port": "P1",
      "pinIndex": 2,
      "defaultType": "other_system",
      "isClockCapable": false,
      "powerDomain": "peripheral",
      "functions": ["NFC1", "Digital I/O", "NFC input"],
      "side": "left"
    },
    {
      "packagePinId": "4",
      "name": "P1.03",
      "port": "P1",
      "pinIndex": 3,
      "defaultType": "other_system",
      "isClockCapable": true,
      "powerDomain": "peripheral",
      "functions": ["NFC2", "Digital I/O", "NFC input"],
      "side": "left"
    },
    {
      "packagePinId": "5",
      "name": "P1.04",
      "port": "P1",
      "pinIndex": 4,
      "defaultType": "io",
      "isClockCapable": true,
      "powerDomain": "peripheral",
      "functions": [
        "ASO[0]",
        "AIN0",
        "Digital I/O",
        "TAMPC active shield 0 output",
        "Analog input"
      ],
      "side": "left"
    },
    {
      "packagePinId": "6",
      "name": "P1.16",
      "port": "P1",
      "pinIndex": 16,
      "defaultType": "io",
      "isClockCapable": false,
      "powerDomain": "peripheral",
      "functions": ["Digital I/O"],
      "side": "left"
    },
    {
      "packagePinId": "7",
      "name": "P1.05",
      "port": "P1",
      "pinIndex": 5,
      "defaultType": "io",
      "isClockCapable": false,
      "powerDomain": "peripheral",
      "functions": [
        "ASI[0]",
        "RADIO[6]",
        "AIN1",
        "Digital I/O",
        "TAMPC active shield 0 input",
        "Analog input"
      ],
      "side": "left"
    },
    {
      "packagePinId": "8",
      "name": "P1.06",
      "port": "P1",
      "pinIndex": 6,
      "defaultType": "io",
      "isClockCapable": false,
      "powerDomain": "peripheral",
      "functions": [
        "ASO[1]",
        "AIN2",
        "Digital I/O",
        "TAMPC active shield 1 output",
        "Analog input"
      ],
      "side": "left"
    },
    {
      "packagePinId": "9",
      "name": "P1.07",
      "port": "P1",
      "pinIndex": 7,
      "defaultType": "io",
      "isClockCapable": false,
      "powerDomain": "peripheral",
      "functions": [
        "ASI[1]",
        "AIN3",
        "Digital I/O",
        "TAMPC active shield 1 input",
        "Analog input"
      ],
      "side": "left"
    },
    {
      "packagePinId": "10",
      "name": "P1.08",
      "port": "P1",
      "pinIndex": 8,
      "defaultType": "io",
      "isClockCapable": true,
      "powerDomain": "peripheral",
      "functions": [
        "CLK16M",
        "EXTREF",
        "Digital I/O",
        "GRTC HF clock output",
        "External reference for SAADC"
      ],
      "side": "left"
    },
    {
      "packagePinId": "11",
      "name": "VDD",
      "port": null,
      "pinIndex": null,
      "defaultType": "power_positive",
      "isClockCapable": false,
      "functions": ["Power supply"],
      "side": "left"
    },
    {
      "packagePinId": "12",
      "name": "P2.00",
      "port": "P2",
      "pinIndex": 0,
      "defaultType": "io",
      "isClockCapable": false,
      "powerDomain": "mcu",
      "functions": ["Digital I/O", "SPIM DCX", "UARTE RXD", "QSPI D3"],
      "side": "left"
    },
    {
      "packagePinId": "13",
      "name": "P2.01",
      "port": "P2",
      "pinIndex": 1,
      "defaultType": "io",
      "isClockCapable": true,
      "powerDomain": "mcu",
      "functions": ["Digital I/O", "SPIM SCK", "SPIS SCK", "QSPI SCK"],
      "side": "left"
    },
    {
      "packagePinId": "14",
      "name": "P2.02",
      "port": "P2",
      "pinIndex": 2,
      "defaultType": "io",
      "isClockCapable": false,
      "powerDomain": "mcu",
      "functions": [
        "Digital I/O",
        "SPIM SDO",
        "SPIS SDO",
        "UARTE TXD",
        "QSPI D0",
        "Serial wire output (SWO)"
      ],
      "side": "bottom"
    },
    {
      "packagePinId": "15",
      "name": "P2.03",
      "port": "P2",
      "pinIndex": 3,
      "defaultType": "io",
      "isClockCapable": false,
      "powerDomain": "mcu",
      "functions": ["Digital I/O", "QSPI D2"],
      "side": "bottom"
    },
    {
      "packagePinId": "16",
      "name": "P2.04",
      "port": "P2",
      "pinIndex": 4,
      "defaultType": "io",
      "isClockCapable": false,
      "powerDomain": "mcu",
      "functions": [
        "Digital I/O",
        "SPIM SDI",
        "SPIS SDI",
        "UARTE CTS",
        "QSPI D1"
      ],
      "side": "bottom"
    },
    {
      "packagePinId": "17",
      "name": "P2.05",
      "port": "P2",
      "pinIndex": 5,
      "defaultType": "io",
      "isClockCapable": false,
      "powerDomain": "mcu",
      "functions": ["Digital I/O", "SPIM CS", "UARTE RTS", "QSPI CS"],
      "side": "bottom"
    },
    {
      "packagePinId": "18",
      "name": "P2.06",
      "port": "P2",
      "pinIndex": 6,
      "defaultType": "io",
      "isClockCapable": true,
      "powerDomain": "mcu",
      "functions": [
        "TRACECLK",
        "Digital I/O",
        "SPIM SCK",
        "SPIS SCK",
        "Trace clock"
      ],
      "side": "bottom"
    },
    {
      "packagePinId": "19",
      "name": "P2.07",
      "port": "P2",
      "pinIndex": 7,
      "defaultType": "io",
      "isClockCapable": false,
      "powerDomain": "mcu",
      "functions": [
        "TRACEDATA[0]",
        "SWO",
        "Digital I/O",
        "Trace data",
        "Serial wire output (SWO)",
        "SPIM DCX",
        "UARTE RXD"
      ],
      "side": "bottom"
    },
    {
      "packagePinId": "20",
      "name": "P2.08",
      "port": "P2",
      "pinIndex": 8,
      "defaultType": "io",
      "isClockCapable": false,
      "powerDomain": "mcu",
      "functions": [
        "TRACEDATA[1]",
        "Digital I/O",
        "Trace data",
        "SPIM SDO",
        "SPIS SDO",
        "UARTE TXD"
      ],
      "side": "bottom"
    },
    {
      "packagePinId": "21",
      "name": "P2.09",
      "port": "P2",
      "pinIndex": 9,
      "defaultType": "io",
      "isClockCapable": false,
      "powerDomain": "mcu",
      "functions": [
        "TRACEDATA[2]",
        "Digital I/O",
        "Trace data",
        "SPIM SDI",
        "SPIS SDI",
        "UARTE CTS"
      ],
      "side": "bottom"
    },
    {
      "packagePinId": "22",
      "name": "P2.10",
      "port": "P2",
      "pinIndex": 10,
      "defaultType": "io",
      "isClockCapable": false,
      "powerDomain": "mcu",
      "functions": [
        "TRACEDATA[3]",
        "Digital I/O",
        "Trace data",
        "SPIM CS",
        "UARTE RTS"
      ],
      "side": "bottom"
    },
    {
      "packagePinId": "23",
      "name": "VDD",
      "port": null,
      "pinIndex": null,
      "defaultType": "power_positive",
      "isClockCapable": false,
      "functions": ["Power supply"],
      "side": "bottom"
    },
    {
      "packagePinId": "24",
      "name": "P0.06",
      "port": "P0",
      "pinIndex": 6,
      "defaultType": "io",
      "isClockCapable": false,
      "powerDomain": "low_power",
      "functions": ["Digital I/O"],
      "side": "bottom"
    },
    {
      "packagePinId": "25",
      "name": "P0.00",
      "port": "P0",
      "pinIndex": 0,
      "defaultType": "io",
      "isClockCapable": false,
      "powerDomain": "low_power",
      "functions": ["Digital I/O"],
      "side": "bottom"
    },
    {
      "packagePinId": "26",
      "name": "P0.01",
      "port": "P0",
      "pinIndex": 1,
      "defaultType": "io",
      "isClockCapable": false,
      "powerDomain": "low_power",
      "functions": ["Digital I/O"],
      "side": "bottom"
    },
    {
      "packagePinId": "27",
      "name": "SWDIO",
      "port": null,
      "pinIndex": null,
      "defaultType": "debug",
      "isClockCapable": false,
      "functions": [
        "Serial wire data. Bidirectional with standard-drive and on-chip pull-down."
      ],
      "side": "right"
    },
    {
      "packagePinId": "28",
      "name": "SWDCLK",
      "port": null,
      "pinIndex": null,
      "defaultType": "debug",
      "isClockCapable": false,